colour_name,hex_value,api_featured_image,brand,category,created_at,currency,description,id,image_link,name,price,price_sign,product_api_url,product_link,product_type,rating,tag_list,updated_at,website_link,distances
Too Cool ,#d3cfcc,//s3.amazonaws.com/donovanbailey/products/api_featured_images/000/000/279/original/open-uri20171223-4-h37y2c?1514063292,maybelline,,2016-10-01 18:30:10.665,,"Dare to wear 24HR shadow!Maybelline's Color Tattoo Cream Gel Shadow uses ink technology for their most intense, long-lasting colour saturation. The cream formula glides on without creasing and keeps colour vibrant.Ophthalmologist-tested. Safe for sensitive eyes and contact lens wearers.
                    
                    
                    
                        
                        For best results: With 
fingertips, sweep all over eye from inner corner and work outwards. For
 added drama, darken as desired.               ",279,"https://d3t32hsnjxo7q6.cloudfront.net/i/c2ddacc79f4fdd3d23664581c76546bc_ra,w158,h184_pa,w158,h184.png",Maybelline Eye Studio Color Tattoo 24HR Cream Gel Shadow,8.99,,http://makeup-api.herokuapp.com/api/v1/products/279.json,https://well.ca/products/maybelline-eye-studio-color-tattoo_50692.html,eyeshadow,4.5,[],2017-12-23 21:08:13.016,https://well.ca,212.81212371479216
color 2,#CFC8CB,//s3.amazonaws.com/donovanbailey/products/api_featured_images/000/000/299/original/data?1514063297,covergirl,,2016-10-01 18:30:45.878,,"This collection of great shades is handpicked by CoverGirl's makeup pros and 
designed to make your eye look go from day to night. They blend 
effortlessly to bring your eyes out beautifully, without overshadowing. 
Experiment using them together or as single shades.Features:Matte, pearl, and sparkle shadesHandpicked by CoverGirl's makeup pros to make your eye look go from day to nightBlends easily without overshadowingTips for Use:
                            
                            
                               
                            
                            
                               Dust the most neutral shadow in your 3-Kit palette from your lash line to brow line. Blend the second-darkest shade along the crease of your eyes. Run the darkest shade along your upper and lower lash lines. Finish the look with two coats of mascara. 
                            
                        
                            
                        ",299,"https://d3t32hsnjxo7q6.cloudfront.net/i/e48da5acde28bd3b1bcc2bff5b9d4a56_ra,w158,h184_pa,w158,h184.jpeg",CoverGirl Eye Enhancers 3-Kit Shadows ,6.49,,http://makeup-api.herokuapp.com/api/v1/products/299.json,https://well.ca/products/covergirl-eye-enhancers-3-kit_59872.html,eyeshadow,4.0,[],2017-12-23 21:08:17.105,https://well.ca,212.8919913946976
Deco,#f1d1c5,//s3.amazonaws.com/donovanbailey/products/api_featured_images/000/000/522/original/open-uri20171223-4-11pgrcf?1514062149,smashbox,,2016-10-02 01:32:54.035,,"We polled makeup artists in our L.A. photo studio for their most versatile, eye-enhancing shades—then packed their faves into one-swipe, true-color singles.Super blendable, velvety formulaHighly pigmented, even colorStart with our 24-Hour Photo Finish Shadow Primer to lock in around-the-clock color.
              
                Formulated without Parabens, Sodium Lauryl Sulfate, Phthalates, Fragrance & Talc.INGREDIENTS: MICA , NYLON-12 , PTFE , ZINC STEARATE , BORON NITRIDE , DIMETHICONE , POLYMETHYLSILSESQUIOXANE , TOCOPHERYL ACETATE , ASCORBYL PALMITATE , LAUROYL LYSINE , PYRUS MALUS (APPLE) FRUIT EXTRACT , GLYCERIN , CYCLOPENTASILOXANE , CAPRYLYL GLYCOL , SILICA , TIN OXIDE , POLYSILICONE-11 , ISOPENTYLDIOL , PHENOXYETHANOL , [+/- TITANIUM DIOXIDE (CI 77891) , IRON OXIDES (CI 77491, CI 77492, CI 77499) , BISMUTH OXYCHLORIDE (CI 77163) , BLUE 1 LAKE (CI 42090) , CARMINE (CI 75470) , CHROMIUM HYDROXIDE GREEN (CI 77289) , CHROMIUM OXIDE GREENS (CI 77288) , FERRIC FERROCYANIDE (CI 77510) , MANGANESE VIOLET (CI 77742) , ULTRAMARINES (CI 77007) , YELLOW 5 LAKE (CI 19140)]
                <ILNILN38427>
                  Please be aware that ingredient lists may change or vary from time to time. Please refer to the ingredient list on the product package you receive for the most up to date list of ingredients.
              
            We polled makeup artists in our L.A. photo studio for their most versatile, eye-enhancing shades—then packed their faves into one-swipe, true-color singles.Super blendable, velvety formulaHighly pigmented, even colorStart with our 24-Hour Photo Finish Shadow Primer to lock in around-the-clock color.
              
                Formulated without Parabens, Sodium Lauryl Sulfate, Phthalates, Fragrance & Talc.INGREDIENTS: MICA , NYLON-12 , PTFE , ZINC STEARATE , BORON NITRIDE , DIMETHICONE , POLYMETHYLSILSESQUIOXANE , TOCOPHERYL ACETATE , ASCORBYL PALMITATE , LAUROYL LYSINE , PYRUS MALUS (APPLE) FRUIT EXTRACT , GLYCERIN , CYCLOPENTASILOXANE , CAPRYLYL GLYCOL , SILICA , TIN OXIDE , POLYSILICONE-11 , ISOPENTYLDIOL , PHENOXYETHANOL , [+/- TITANIUM DIOXIDE (CI 77891) , IRON OXIDES (CI 77491, CI 77492, CI 77499) , BISMUTH OXYCHLORIDE (CI 77163) , BLUE 1 LAKE (CI 42090) , CARMINE (CI 75470) , CHROMIUM HYDROXIDE GREEN (CI 77289) , CHROMIUM OXIDE GREENS (CI 77288) , FERRIC FERROCYANIDE (CI 77510) , MANGANESE VIOLET (CI 77742) , ULTRAMARINES (CI 77007) , YELLOW 5 LAKE (CI 19140)]
                <ILNILN38427>
                  Please be aware that ingredient lists may change or vary from time to time. Please refer to the ingredient list on the product package you receive for the most up to date list of ingredients.
              
            ",522,https://www.smashbox.com/media/images/products/388x396/sbx_sku_73232_388x396_0.jpg,PHOTO OP EYE SHADOW SINGLES,18.0,,http://makeup-api.herokuapp.com/api/v1/products/522.json,http://www.smashbox.com/product/6029/42940/eyes/eye-shadow/photo-op-eye-shadow-singles/new,eyeshadow,,[],2017-12-23 20:49:09.561,http://www.smashbox.com/,213.1056076221365
Wild Orchid (HS05) Iridescent Fuchsia  ,#E65371,//s3.amazonaws.com/donovanbailey/products/api_featured_images/000/000/297/original/open-uri20171223-4-16md1w7?1514063296,nyx,,2016-10-01 18:30:42.210,,"NYX’s Hot Singles are intense! Powerfully loaded with pigments, this versatile formula lets you make a statement for any occasion.  Features:Stunning range of highly-pigmented shadows in shimmer, matte, metallic and iridescent finishesCreates a variety of eye makeup looksNYX’s unique formulation is easy to blend and build onHow to Use: Use with eye shadow base. Apply choice of colors to create edgy, natural and artistic eye looks.",297,"https://d3t32hsnjxo7q6.cloudfront.net/i/355a8d67acc1b30be6be8dce5b1c8ef0_ra,w158,h184_pa,w158,h184.png",NYX Hot Singles Eye Shadow ,5.99,,http://makeup-api.herokuapp.com/api/v1/products/297.json,https://well.ca/products/nyx-hot-singles-eye-shadow_106074.html,eyeshadow,5.0,[],2017-12-23 21:08:16.742,https://well.ca,213.28150412072773
208 NAVY DESIGN,#C5C5CC,//s3.amazonaws.com/donovanbailey/products/api_featured_images/000/000/694/original/open-uri20171223-4-13spuxr?1514062731,dior,,2017-12-03 23:22:50.561,GBP,"Born of Backstage expertise, inspired by professional techniques and textures, 5 COULEURS DESIGNER features an easy, 5-step makeup lesson (base, 2 shadows, highlighter and liner) to bring out the eyes with flawless sculpting and colour gradation.",694,https://www.dior.com/beauty/version-5.1432748111912/resize-image/ep/0/390/100/0/packshots%252FPDG_Y0148140_f014814208_112016.jpg,5 COULEURS DESIGNER,45.0,£,http://makeup-api.herokuapp.com/api/v1/products/694.json,https://www.dior.com/beauty/en_gb/fragrance-beauty/makeup/eyes/eyeshadows/pr-eyeshadows-y0148140-the-makeup-artist-tutorial-palette.html,eyeshadow,,[],2017-12-23 20:58:51.822,https://www.dior.com,213.32838535928593
On Safari 4,#4a4b38,//s3.amazonaws.com/donovanbailey/products/api_featured_images/000/000/807/original/data?1514072321,clinique,,2017-12-23 23:35:13.329,USD,Wear shades alone or layered together in different combinations. Crease- and fade-resistant. Ophthalmologist tested for even the most sensitive eyes and contact lens wearers. Mirrored compact with illustrated how-tos plus two sponge-tip applicators.,807,https://www.clinique.com/media/export/cms/products/181x209/clq_7PWL06_181x209.png,All About Shadow&trade; Quad,28.5,$,http://makeup-api.herokuapp.com/api/v1/products/807.json,https://www.clinique.com/product/1598/27033/makeup/eye-shadows/all-about-shadow-quad,eyeshadow,,[],2017-12-23 23:38:41.793,https://www.clinique.com,213.39165869358624
Portobello,#5b4540,//s3.amazonaws.com/donovanbailey/products/api_featured_images/000/000/809/original/data?1514072322,clinique,,2017-12-23 23:35:14.522,USD,"Creamy colour glides on in one smooth stroke. Longwearing. Crease- and fade-resistant, too. Ophthalmologist tested for even the most sensitive eyes and contact lens wearers. Mirrored compact comes with a sponge-tip applicator.",809,https://www.clinique.com/media/export/cms/products/181x209/clq_7PWG_181x209.png,All About Shadow&trade; Single,16.5,$,http://makeup-api.herokuapp.com/api/v1/products/809.json,https://www.clinique.com/product/1598/27031/makeup/eye-shadows/all-about-shadow-single,eyeshadow,,[],2017-12-23 23:38:42.444,https://www.clinique.com,213.49707257946184
Ivory Bisque/Bronze Satin,"#e9d5ca,#896a58",//s3.amazonaws.com/donovanbailey/products/api_featured_images/000/000/806/original/data?1514072321,clinique,,2017-12-23 23:35:12.387,USD,"Use one shade as a base colour, the other to contour. Crease- and fade-resistant. Ophthalmologist tested for even the most sensitive eyes and contact lens wearers. Mirrored compact with illustrated how-tos plus a brush/sponge-tip applicator.",806,https://www.clinique.com/media/export/cms/products/181x209/clq_7PWK_181x209.png,All About Shadow&trade; Duo,22.0,$,http://makeup-api.herokuapp.com/api/v1/products/806.json,https://www.clinique.com/product/1598/27032/makeup/eye-shadows/all-about-shadow-duo,eyeshadow,,[],2017-12-23 23:38:41.393,https://www.clinique.com,214.59030733003763
Crocus (Demi-Matte Lilac Purple ,#9786b0,//s3.amazonaws.com/donovanbailey/products/api_featured_images/000/000/275/original/data?1514063291,pure anada,,2016-10-01 18:30:03.877,,"Pure Anada is pleased to bring you a lovely selection of convenient pressed mineral colors!   You’ll love the silky texture and longevity of these very wearable shades.Mineral pigments and organic Jojoba are pressed together to create a natural makeup product. You can have confidence that you are making a beautiful, healthy choice!Pure Anada pressed colors are designed to be inserted into customizable magnetic compacts like the Pure Ananda Reusable Magnetic Compact. Design your own palette! What look do you go for: the natural bronzed babe, tropical brights, or classic beauty? Try all three with this get the look with natural makeup piece found on our blog, The Well! Shadow Finishes: Demi-Matte shadows are a combination of opaque matte minerals and luminous satin mica.  This provides both true color and a light-reflecting finish.Matte shadows are soft, silky shadows that do not exude any sheen whatsoever.Shades: Ingredients: Mica (CI 77019), Iron Oxides (CI 77492, CI 77499) Calcium Carbonate, Caprylic Triglyceride *Simmondsia Chinensis (Jojoba seed oil) Ultramarines (CI 77007), Titanium Dioxide (CI 77891) * Certified Organic IngredientVegan, Gluten Free, Non-GMO, Dairy Free, Peanut Free, Natural",275,"https://d3t32hsnjxo7q6.cloudfront.net/i/9b489f80495f5d059d0f49ef38c36664_ra,w158,h184_pa,w158,h184.jpeg",Pure Anada Pressed Mineral Eye Color Pan,8.0,,http://makeup-api.herokuapp.com/api/v1/products/275.json,https://well.ca/products/pure-anada-pressed-mineral-eye-color_83502.html,eyeshadow,4.5,"[Canadian, Non-GMO, Gluten Free, Vegan, Natural]",2017-12-23 21:08:11.558,https://well.ca,214.8162005063864
Lilac 07 ,#B8A3C2,//s3.amazonaws.com/donovanbailey/products/api_featured_images/000/000/310/original/data?1514063298,dr. hauschka,,2016-10-01 18:31:04.883,,Dr. Hauschka Eyeshadow Solos incorporate the finest mineral pigments with real silk to create make-up that is kind to the delicate skin on your eyes.  Nine gentle tones enhance the natural beauty of your eyes.  Added medicinal plant extracts nurture the sensitive skin around your eyes for added radiance and shine.,310,"https://d3t32hsnjxo7q6.cloudfront.net/i/0a001646e27fecf93ffd46d731ae0d1f_ra,w158,h184_pa,w158,h184.jpg",Dr. Hauschka Eye Shadow ,22.0,,http://makeup-api.herokuapp.com/api/v1/products/310.json,https://well.ca/products/dr-hauschka-eye-shadow_34273.html,eyeshadow,5.0,[Natural],2017-12-23 21:08:18.676,https://well.ca,214.94185260204677
Wave after Wave,"#c9d4d1,#718b88",//s3.amazonaws.com/donovanbailey/products/api_featured_images/000/000/806/original/data?1514072321,clinique,,2017-12-23 23:35:12.387,USD,"Use one shade as a base colour, the other to contour. Crease- and fade-resistant. Ophthalmologist tested for even the most sensitive eyes and contact lens wearers. Mirrored compact with illustrated how-tos plus a brush/sponge-tip applicator.",806,https://www.clinique.com/media/export/cms/products/181x209/clq_7PWK_181x209.png,All About Shadow&trade; Duo,22.0,$,http://makeup-api.herokuapp.com/api/v1/products/806.json,https://www.clinique.com/product/1598/27032/makeup/eye-shadows/all-about-shadow-duo,eyeshadow,,[],2017-12-23 23:38:41.393,https://www.clinique.com,215.0790552331863
Jade,#CBD0D0,//s3.amazonaws.com/donovanbailey/products/api_featured_images/000/001/024/original/open-uri20180630-4-13b5ehh?1530390375,marienatie,,2018-06-30 19:19:31.101,USD,"Long-lasting eye colours delivering an instant glam and shimmer.  Silky and soft texture of MarieNatie glides on easily when applied wet or dry.  Magnesium stearate repels water and will help keep your eye shadow on all day and absorb any extra oil.  Kaolin clay will help to purify, soothe different skin types.",1024,https://www.purpicks.com/wp-content/uploads/csm/Loose_MineralEyeshadow_1024x1024_a958d62b-c518-4548-a2cd-9c8981f5edee1.jpg,Loose Mineral Eyeshadow,0.0,$,http://makeup-api.herokuapp.com/api/v1/products/1024.json,https://www.purpicks.com/product/marie-natie-loose-mineral-eyeshadow/,eyeshadow,,"[CertClean, purpicks]",2018-09-02 22:52:06.518,https://purpicks.com/,215.20687721353144
Color 3,#4F7386,//s3.amazonaws.com/donovanbailey/products/api_featured_images/000/001/015/original/open-uri20180630-4-egfs2g?1530390369,lotus cosmetics usa,palette,2018-06-30 19:19:30.555,USD,A four-color eyeshadow palette infused with natural minerals and antioxidant rich extracts to help prevent fine lines and wrinkles. Easily blendable shades give you the ability to create effortlessly natural or dramatic looks. Made with natural and organic ingredients.,1015,http://www.purpicks.com/wp-content/uploads/2018/03/lotus-cosmetics-usa-eye-shadow-palette-deluxe.png,Eye Shadow Palette Deluxe,0.0,$,http://makeup-api.herokuapp.com/api/v1/products/1015.json,https://www.purpicks.com/product/lotus-cosmetics-usa/,eyeshadow,,"[Organic, USDA Organic, purpicks]",2018-09-02 22:52:06.788,https://purpicks.com/,215.82631906234235
848 Focus,#E59EB9,//s3.amazonaws.com/donovanbailey/products/api_featured_images/000/000/691/original/open-uri20171223-4-1mp005c?1514062731,dior,,2017-12-03 23:22:42.681,GBP,"Diorshow Mono, the eyeshadow used by the Dior makeup artists, was inspired by the fabric textures of the brand's fashions - matte, silky, ultra-glittery and lamé - and features super-saturated hues to deck the eyes in long-lasting colors with radiant finishes.",691,https://www.dior.com/beauty/version-5.1432748111912/resize-image/ep/0/390/100/0/packshots%252FPDG_y0147160_f014716623.jpg,Diorshow Mono,25.0,£,http://makeup-api.herokuapp.com/api/v1/products/691.json,https://www.dior.com/beauty/en_gb/fragrance-beauty/makeup/eyes/eyeshadows/pr-eyeshadows-y0147160-professional-eye-shadow-spectacular-effects-long-wear.html,eyeshadow,,[],2017-12-23 20:58:51.143,https://www.dior.com,216.00694433281538
Creamy Chocolate ,#5C3B27,//s3.amazonaws.com/donovanbailey/products/api_featured_images/000/000/307/original/open-uri20171223-4-5xfc8v?1514063298,maybelline,,2016-10-01 18:30:58.610,,"Maybelline Eyestudio Color Tattoo Concentrated Crayons give you high-intensity color that looks vibrant all-day long.Features:Smooth, soft creamy finishPlayful intense colorsAll day tattoo tenacity. Playful color intensity. In an easy glide on crayon.",307,"https://d3t32hsnjxo7q6.cloudfront.net/i/3f9f894b56e0616e44c5ee01dea45217_ra,w158,h184_pa,w158,h184.png",Maybelline Eyestudio Color Tattoo Concentrated Crayon,10.99,,http://makeup-api.herokuapp.com/api/v1/products/307.json,https://well.ca/products/maybelline-eyestudio-color-tattoo_114535.html,eyeshadow,3.0,[],2017-12-23 21:08:18.441,https://well.ca,216.01157376399996
Cameo (Demi-Matte Light Pink White) ,#ecc2c6,//s3.amazonaws.com/donovanbailey/products/api_featured_images/000/000/275/original/data?1514063291,pure anada,,2016-10-01 18:30:03.877,,"Pure Anada is pleased to bring you a lovely selection of convenient pressed mineral colors!   You’ll love the silky texture and longevity of these very wearable shades.Mineral pigments and organic Jojoba are pressed together to create a natural makeup product. You can have confidence that you are making a beautiful, healthy choice!Pure Anada pressed colors are designed to be inserted into customizable magnetic compacts like the Pure Ananda Reusable Magnetic Compact. Design your own palette! What look do you go for: the natural bronzed babe, tropical brights, or classic beauty? Try all three with this get the look with natural makeup piece found on our blog, The Well! Shadow Finishes: Demi-Matte shadows are a combination of opaque matte minerals and luminous satin mica.  This provides both true color and a light-reflecting finish.Matte shadows are soft, silky shadows that do not exude any sheen whatsoever.Shades: Ingredients: Mica (CI 77019), Iron Oxides (CI 77492, CI 77499) Calcium Carbonate, Caprylic Triglyceride *Simmondsia Chinensis (Jojoba seed oil) Ultramarines (CI 77007), Titanium Dioxide (CI 77891) * Certified Organic IngredientVegan, Gluten Free, Non-GMO, Dairy Free, Peanut Free, Natural",275,"https://d3t32hsnjxo7q6.cloudfront.net/i/9b489f80495f5d059d0f49ef38c36664_ra,w158,h184_pa,w158,h184.jpeg",Pure Anada Pressed Mineral Eye Color Pan,8.0,,http://makeup-api.herokuapp.com/api/v1/products/275.json,https://well.ca/products/pure-anada-pressed-mineral-eye-color_83502.html,eyeshadow,4.5,"[Canadian, Non-GMO, Gluten Free, Vegan, Natural]",2017-12-23 21:08:11.558,https://well.ca,216.26141588364763
757 Dream,#D9CDCE,//s3.amazonaws.com/donovanbailey/products/api_featured_images/000/000/692/original/open-uri20171223-4-1ia7ngs?1514062731,dior,,2017-12-03 23:22:47.200,GBP,"An icon of the Dior look and a concentration of expertise in terms of colour and visual effects, the 5 Couleurs palette is reinvented. More creative than ever, with stronger pigments and richer effects, it allows women to explore every facet of colour and express every aspect of their personality. With the 5 Couleurs palette, self-expression is unlimited, creativity is unleashed and colour is more audacious than ever.",692,https://www.dior.com/beauty/version-5.1432748111912/resize-image/ep/0/390/100/0/packshots%252FPDG_Y0148410.jpg,5 COULEURS,45.0,£,http://makeup-api.herokuapp.com/api/v1/products/692.json,https://www.dior.com/beauty/en_gb/fragrance-beauty/makeup/eyes/eyeshadows/pr-eyeshadows-y0148410-high-fidelity-colours-effects-eyeshadow-palette.html,eyeshadow,,[],2017-12-23 20:58:51.384,https://www.dior.com,216.2984049871843
357 Electrify,#CFD1D1,//s3.amazonaws.com/donovanbailey/products/api_featured_images/000/000/692/original/open-uri20171223-4-1ia7ngs?1514062731,dior,,2017-12-03 23:22:47.200,GBP,"An icon of the Dior look and a concentration of expertise in terms of colour and visual effects, the 5 Couleurs palette is reinvented. More creative than ever, with stronger pigments and richer effects, it allows women to explore every facet of colour and express every aspect of their personality. With the 5 Couleurs palette, self-expression is unlimited, creativity is unleashed and colour is more audacious than ever.",692,https://www.dior.com/beauty/version-5.1432748111912/resize-image/ep/0/390/100/0/packshots%252FPDG_Y0148410.jpg,5 COULEURS,45.0,£,http://makeup-api.herokuapp.com/api/v1/products/692.json,https://www.dior.com/beauty/en_gb/fragrance-beauty/makeup/eyes/eyeshadows/pr-eyeshadows-y0148410-high-fidelity-colours-effects-eyeshadow-palette.html,eyeshadow,,[],2017-12-23 20:58:51.384,https://www.dior.com,216.53175286779535
981,#8B4E78,//s3.amazonaws.com/donovanbailey/products/api_featured_images/000/000/689/original/open-uri20171223-4-b1imkg?1514062730,dior,,2017-12-03 23:22:40.725,GBP,"A weightless texture that blends into the skin and dresses the eye in velvety colour. In a single step, it creates an even and intense matte finish for a professional makeup effect.",689,https://www.dior.com/beauty/version-5.1432748111912/resize-image/ep/0/390/100/0/packshots%252FPDG_Y0148300_F014830821_012016.jpg,Diorshow Fusion Mono,25.5,£,http://makeup-api.herokuapp.com/api/v1/products/689.json,https://www.dior.com/beauty/en_gb/fragrance-beauty/makeup/eyes/eyeshadows/pr-eyeshadows-y0148300-long-wear-professional-mirror-shine-eyeshadow.html,eyeshadow,,[],2017-12-23 20:58:50.521,https://www.dior.com,216.6887168266959
Bubble Bath,#d699bb,//s3.amazonaws.com/donovanbailey/products/api_featured_images/000/000/809/original/data?1514072322,clinique,,2017-12-23 23:35:14.522,USD,"Creamy colour glides on in one smooth stroke. Longwearing. Crease- and fade-resistant, too. Ophthalmologist tested for even the most sensitive eyes and contact lens wearers. Mirrored compact comes with a sponge-tip applicator.",809,https://www.clinique.com/media/export/cms/products/181x209/clq_7PWG_181x209.png,All About Shadow&trade; Single,16.5,$,http://makeup-api.herokuapp.com/api/v1/products/809.json,https://www.clinique.com/product/1598/27031/makeup/eye-shadows/all-about-shadow-single,eyeshadow,,[],2017-12-23 23:38:42.444,https://www.clinique.com,216.7325540845214
color 7,#F0DFCC,//s3.amazonaws.com/donovanbailey/products/api_featured_images/000/000/814/original/data?1514072323,clinique,palette,2017-12-23 23:35:16.300,USD,"Clinique's Pretty Easy Eye Palette comes with eight shades of long-wearing All About Shadow in a variety of finishes. For instant lashline definition, there's Skinny Stick, our no-sharpener-required eye liner in two must-have shades. Create your own custom eye looks or follow the illustrated how-tos.",814,https://www.clinique.com/media/export/cms/products/181x209/clq_ZJPL01_181x209.png,Pretty Easy™ Eye Palette,22.25,$,http://makeup-api.herokuapp.com/api/v1/products/814.json,https://www.clinique.com/product/1598/38686/makeup/eye-shadows/pretty-easytm-eye-palette,eyeshadow,,[],2017-12-26 00:33:00.462,https://www.clinique.com,216.78560837841613
Color 1,#F4DACA,//s3.amazonaws.com/donovanbailey/products/api_featured_images/000/001/015/original/open-uri20180630-4-egfs2g?1530390369,lotus cosmetics usa,palette,2018-06-30 19:19:30.555,USD,A four-color eyeshadow palette infused with natural minerals and antioxidant rich extracts to help prevent fine lines and wrinkles. Easily blendable shades give you the ability to create effortlessly natural or dramatic looks. Made with natural and organic ingredients.,1015,http://www.purpicks.com/wp-content/uploads/2018/03/lotus-cosmetics-usa-eye-shadow-palette-deluxe.png,Eye Shadow Palette Deluxe,0.0,$,http://makeup-api.herokuapp.com/api/v1/products/1015.json,https://www.purpicks.com/product/lotus-cosmetics-usa/,eyeshadow,,"[Organic, USDA Organic, purpicks]",2018-09-02 22:52:06.788,https://purpicks.com/,216.96313050838845
277 Defy,#C5C9D1,//s3.amazonaws.com/donovanbailey/products/api_featured_images/000/000/692/original/open-uri20171223-4-1ia7ngs?1514062731,dior,,2017-12-03 23:22:47.200,GBP,"An icon of the Dior look and a concentration of expertise in terms of colour and visual effects, the 5 Couleurs palette is reinvented. More creative than ever, with stronger pigments and richer effects, it allows women to explore every facet of colour and express every aspect of their personality. With the 5 Couleurs palette, self-expression is unlimited, creativity is unleashed and colour is more audacious than ever.",692,https://www.dior.com/beauty/version-5.1432748111912/resize-image/ep/0/390/100/0/packshots%252FPDG_Y0148410.jpg,5 COULEURS,45.0,£,http://makeup-api.herokuapp.com/api/v1/products/692.json,https://www.dior.com/beauty/en_gb/fragrance-beauty/makeup/eyes/eyeshadows/pr-eyeshadows-y0148410-high-fidelity-colours-effects-eyeshadow-palette.html,eyeshadow,,[],2017-12-23 20:58:51.384,https://www.dior.com,217.08523671590382
Portly Plum,#765074,//s3.amazonaws.com/donovanbailey/products/api_featured_images/000/000/808/original/data?1514072321,clinique,pencil,2017-12-23 23:35:13.780,USD,"Sheer wash of lightweight, creamy colour slips on. Layerable and long-wearing. Versatile, too.",808,https://www.clinique.com/media/export/cms/products/181x209/clq_7NYF01_181x209.png,Chubby Stick&trade; Shadow Tint For Eyes,17.5,$,http://makeup-api.herokuapp.com/api/v1/products/808.json,https://www.clinique.com/product/1598/22855/makeup/eye-shadows/chubby-stick-shadow-tint-for-eyes,eyeshadow,,[],2017-12-26 01:07:49.416,https://www.clinique.com,217.29473072304353
