colour_name,hex_value,api_featured_image,brand,category,created_at,currency,description,id,image_link,name,price,price_sign,product_api_url,product_link,product_type,rating,tag_list,updated_at,website_link,distances
Espresso (Demi-Matte) ,#A06C69,//s3.amazonaws.com/donovanbailey/products/api_featured_images/000/000/275/original/data?1514063291,pure anada,,2016-10-01 18:30:03.877,,"Pure Anada is pleased to bring you a lovely selection of convenient pressed mineral colors!   You’ll love the silky texture and longevity of these very wearable shades.Mineral pigments and organic Jojoba are pressed together to create a natural makeup product. You can have confidence that you are making a beautiful, healthy choice!Pure Anada pressed colors are designed to be inserted into customizable magnetic compacts like the Pure Ananda Reusable Magnetic Compact. Design your own palette! What look do you go for: the natural bronzed babe, tropical brights, or classic beauty? Try all three with this get the look with natural makeup piece found on our blog, The Well! Shadow Finishes: Demi-Matte shadows are a combination of opaque matte minerals and luminous satin mica.  This provides both true color and a light-reflecting finish.Matte shadows are soft, silky shadows that do not exude any sheen whatsoever.Shades: Ingredients: Mica (CI 77019), Iron Oxides (CI 77492, CI 77499) Calcium Carbonate, Caprylic Triglyceride *Simmondsia Chinensis (Jojoba seed oil) Ultramarines (CI 77007), Titanium Dioxide (CI 77891) * Certified Organic IngredientVegan, Gluten Free, Non-GMO, Dairy Free, Peanut Free, Natural",275,"https://d3t32hsnjxo7q6.cloudfront.net/i/9b489f80495f5d059d0f49ef38c36664_ra,w158,h184_pa,w158,h184.jpeg",Pure Anada Pressed Mineral Eye Color Pan,8.0,,http://makeup-api.herokuapp.com/api/v1/products/275.json,https://well.ca/products/pure-anada-pressed-mineral-eye-color_83502.html,eyeshadow,4.5,"[Canadian, Non-GMO, Gluten Free, Vegan, Natural]",2017-12-23 21:08:11.558,https://well.ca,181.190507477627
Color 1,#EBBC9D,//s3.amazonaws.com/donovanbailey/products/api_featured_images/000/001/013/original/open-uri20180630-4-1x4t7kg?1530390367,lotus cosmetics usa,palette,2018-06-30 19:19:30.422,USD,A four-color eyeshadow palette infused with natural minerals and antioxidant rich extracts to help prevent fine lines and wrinkles. Easily blendable shades give you the ability to create effortlessly natural or dramatic looks. Made with natural and organic ingredients.,1013,http://www.purpicks.com/wp-content/uploads/2018/03/lotus-cosmetics-usa-eye-shadow-palette-seduction.png,Eye Shadow Palette Seduction,0.0,$,http://makeup-api.herokuapp.com/api/v1/products/1013.json,https://www.purpicks.com/product/lotus-cosmetics-usa/,eyeshadow,,"[Organic, USDA Organic, purpicks]",2018-09-02 22:52:06.762,https://purpicks.com/,181.2705160802495
color 8,#CA9A94,//s3.amazonaws.com/donovanbailey/products/api_featured_images/000/000/526/original/data?1514062150,smashbox,,2016-10-02 01:32:54.716,,"When we noticed that our makeup artists use matte eye shadows as brow powder and liner on shoots in our L.A. photo studio, we knew we had to create a do-it-all formula just for eyes. Each of the 8 matte shades in this mini-matte collection is a multitasker—from stay-put shadows that double as liner to brow powders that also work as shadows. Plus, each -silky, richly pigmented dark shade intensifies when used wet.Includes:  8 all-matte wet/dry shades that can be used as liner, shadow or brow powder 
              
                Formulated without Parabens, Sodium Lauryl Sulfate, Phthalates, Fragrance & Talc.INGREDIENTS: TALC , DIMETHICONE , DIMETHICONOL STEARATE , LAUROYL LYSINE , DIISOSTEARYL MALATE , CAPRYLYL GLYCOL , HEXYLENE GLYCOL , OCTYLDODECYL STEAROYL STEARATE , PHENOXYETHANOL , [+/- MICA , TITANIUM DIOXIDE (CI 77891) , IRON OXIDES (CI 77491) , IRON OXIDES (CI 77492) , IRON OXIDES (CI 77499) , BISMUTH OXYCHLORIDE (CI 77163) , BLUE 1 LAKE (CI 42090) , CARMINE (CI 75470) , CHROMIUM HYDROXIDE GREEN (CI 77289) , CHROMIUM OXIDE GREENS (CI 77288) , FERRIC AMMONIUM FERROCYANIDE (CI 77510) , FERRIC FERROCYANIDE (CI 77510) , MANGANESE VIOLET (CI 77742) , ULTRAMARINES (CI 77007) , YELLOW 5 LAKE (CI 19140)]
                <ILNILN42102>
                  Please be aware that ingredient lists may change or vary from time to time. Please refer to the ingredient list on the product package you receive for the most up to date list of ingredients.
              
            When we noticed that our makeup artists use matte eye shadows as brow powder and liner on shoots in our L.A. photo studio, we knew we had to create a do-it-all formula just for eyes. Each of the 8 matte shades in this mini-matte collection is a multitasker—from stay-put shadows that double as liner to brow powders that also work as shadows. Plus, each -silky, richly pigmented dark shade intensifies when used wet.Includes:  8 all-matte wet/dry shades that can be used as liner, shadow or brow powder 
              
                Formulated without Parabens, Sodium Lauryl Sulfate, Phthalates, Fragrance & Talc.INGREDIENTS: TALC , DIMETHICONE , DIMETHICONOL STEARATE , LAUROYL LYSINE , DIISOSTEARYL MALATE , CAPRYLYL GLYCOL , HEXYLENE GLYCOL , OCTYLDODECYL STEAROYL STEARATE , PHENOXYETHANOL , [+/- MICA , TITANIUM DIOXIDE (CI 77891) , IRON OXIDES (CI 77491) , IRON OXIDES (CI 77492) , IRON OXIDES (CI 77499) , BISMUTH OXYCHLORIDE (CI 77163) , BLUE 1 LAKE (CI 42090) , CARMINE (CI 75470) , CHROMIUM HYDROXIDE GREEN (CI 77289) , CHROMIUM OXIDE GREENS (CI 77288) , FERRIC AMMONIUM FERROCYANIDE (CI 77510) , FERRIC FERROCYANIDE (CI 77510) , MANGANESE VIOLET (CI 77742) , ULTRAMARINES (CI 77007) , YELLOW 5 LAKE (CI 19140)]
                <ILNILN42102>
                  Please be aware that ingredient lists may change or vary from time to time. Please refer to the ingredient list on the product package you receive for the most up to date list of ingredients.
              
            ",526,https://www.smashbox.com/media/images/products/388x396/sbx_sku_69731_388x396_0.jpg,Photo Matte Eyes Mini,25.0,,http://makeup-api.herokuapp.com/api/v1/products/526.json,http://www.smashbox.com/product/6029/40422/eyes/eye-shadow/photo-matte-eyes-mini/new,eyeshadow,,[],2017-12-23 20:49:10.395,http://www.smashbox.com/,181.35324645563972
Chocolate,#8D6255,//s3.amazonaws.com/donovanbailey/products/api_featured_images/000/001/024/original/open-uri20180630-4-13b5ehh?1530390375,marienatie,,2018-06-30 19:19:31.101,USD,"Long-lasting eye colours delivering an instant glam and shimmer.  Silky and soft texture of MarieNatie glides on easily when applied wet or dry.  Magnesium stearate repels water and will help keep your eye shadow on all day and absorb any extra oil.  Kaolin clay will help to purify, soothe different skin types.",1024,https://www.purpicks.com/wp-content/uploads/csm/Loose_MineralEyeshadow_1024x1024_a958d62b-c518-4548-a2cd-9c8981f5edee1.jpg,Loose Mineral Eyeshadow,0.0,$,http://makeup-api.herokuapp.com/api/v1/products/1024.json,https://www.purpicks.com/product/marie-natie-loose-mineral-eyeshadow/,eyeshadow,,"[CertClean, purpicks]",2018-09-02 22:52:06.518,https://purpicks.com/,181.55715353573927
Color 2,#BE9794,//s3.amazonaws.com/donovanbailey/products/api_featured_images/000/001/012/original/open-uri20180630-4-1rlpw5a?1530390367,lotus cosmetics usa,palette,2018-06-30 19:19:30.347,USD,A four-color eyeshadow palette infused with natural minerals and antioxidant rich extracts to help prevent fine lines and wrinkles. Easily blendable shades give you the ability to create effortlessly natural or dramatic looks. Made with natural and organic ingredients.,1012,https://www.purpicks.com/wp-content/uploads/2018/03/lotus-cosmetics-usa-eye-shadow-palette-cocoa.png,Eye Shadow Palette Cocoa,0.0,$,http://makeup-api.herokuapp.com/api/v1/products/1012.json,https://www.purpicks.com/product/lotus-cosmetics-usa/,eyeshadow,,"[Organic, USDA Organic, purpicks]",2018-09-02 22:52:06.753,https://purpicks.com/,181.59295140505867
Chocolate Suede (95) ,#8A665B,//s3.amazonaws.com/donovanbailey/products/api_featured_images/000/000/291/original/open-uri20171223-4-1693fvq?1514063295,maybelline,,2016-10-01 18:30:28.176,,"
                       
	So rich. So creamy. Only Maybelline's cream gel eye shadow formula gets the look of couture leather so right!
		
			
				Dare to wear Maybelline Color Tattoo leather 24HR long wear eye shadow.Features: Ink technology creates 24HR wear shadow for our most intense, long-lasting color saturationCream eye shadow formula glides on without creasing and keeps color vibrantOphthalmologist-tested.  Safe for sensitive eyes and contact lens wearers
		Shade Range: 
	

                    
                ",291,"https://d3t32hsnjxo7q6.cloudfront.net/i/cf21d194ab14ee3c527d02682c358a7a_ra,w158,h184_pa,w158,h184.png",Maybelline Eye Studio Color Tattoo 24HR Cream Gel Shadow Leather,8.99,,http://makeup-api.herokuapp.com/api/v1/products/291.json,https://well.ca/products/maybelline-eye-studio-color-tattoo_95143.html,eyeshadow,4.3,[],2017-12-23 21:08:16.007,https://well.ca,181.62048342629197
Tropical Sunset,#E8B49B,//s3.amazonaws.com/donovanbailey/products/api_featured_images/000/001/034/original/open-uri20180630-4-1n63e1y?1530390382,rejuva minerals,,2018-06-30 19:19:31.827,USD,"Our Multi Purpose Pressed Powders may be used as eye shadow, brow powder, eye liner, or for highlighting. Blended with antioxidants from Certified Organic Fruits, Berries &amp; Botanicals*. No gluten derived ingredients. VEGAN. All shades will offer a semi-matte finish, with the exception of White Diamond. White Diamond will offer a shimmery finish. Image one shows shade in Iris. This product is EWG VERIFIED&#x2122; and rated 'CLEAN' in the Think Dirty app! BPA and Phthalate free packaging. Plastic parts of compacts are recyclable.",1034,https://www.purpicks.com/wp-content/uploads/2018/06/Rejuva-Minerals-Multi-Purpose-Powder-Eye-Shadow-Face-1.jpg,Multi Purpose Powder - Eye Shadow & Face,0.0,$,http://makeup-api.herokuapp.com/api/v1/products/1034.json,https://www.purpicks.com/product/rejuva-minerals-multi-purpose-powder-eye-shadow-face/,eyeshadow,,"[Organic, Vegan, EWG Verified, purpicks]",2018-09-02 22:52:06.661,https://purpicks.com/,181.69755089158465
Cream Pop,#e3a595,//s3.amazonaws.com/donovanbailey/products/api_featured_images/000/000/810/original/open-uri20171223-4-pewgcj?1514072322,clinique,,2017-12-23 23:35:15.246,USD,"Silky, long-wearing eye shadow delivers an instant pop of colour for a virtually powderless look. Builds and blends easily to a customizable level of intensity. Appropriate for contact lens wearers and sensitive eyes.",810,https://www.clinique.com/media/export/cms/products/181x209/clq_ZKJT02_181x209.png,Lid Pop™,18.0,$,http://makeup-api.herokuapp.com/api/v1/products/810.json,https://www.clinique.com/product/1598/39911/makeup/eye-shadows/lid-poptm,eyeshadow,,[],2017-12-23 23:38:42.733,https://www.clinique.com,181.96153439669604
Taupe  04 ,#AB9695,//s3.amazonaws.com/donovanbailey/products/api_featured_images/000/000/310/original/data?1514063298,dr. hauschka,,2016-10-01 18:31:04.883,,Dr. Hauschka Eyeshadow Solos incorporate the finest mineral pigments with real silk to create make-up that is kind to the delicate skin on your eyes.  Nine gentle tones enhance the natural beauty of your eyes.  Added medicinal plant extracts nurture the sensitive skin around your eyes for added radiance and shine.,310,"https://d3t32hsnjxo7q6.cloudfront.net/i/0a001646e27fecf93ffd46d731ae0d1f_ra,w158,h184_pa,w158,h184.jpg",Dr. Hauschka Eye Shadow ,22.0,,http://makeup-api.herokuapp.com/api/v1/products/310.json,https://well.ca/products/dr-hauschka-eye-shadow_34273.html,eyeshadow,5.0,[Natural],2017-12-23 21:08:18.676,https://well.ca,182.30469001098135
Color 4,#A39796,//s3.amazonaws.com/donovanbailey/products/api_featured_images/000/001/016/original/open-uri20180630-4-1mmjptw?1530390369,lotus cosmetics usa,palette,2018-06-30 19:19:30.618,USD,A four-color eyeshadow palette infused with natural minerals and antioxidant rich extracts to help prevent fine lines and wrinkles. Easily blendable shades give you the ability to create effortlessly natural or dramatic looks. Made with natural and organic ingredients.,1016,http://www.purpicks.com/wp-content/uploads/2018/03/lotus-cosmetics-usa-eye-shadow-palette-mesmerize.png,Eye Shadow Palette Mesmerize,0.0,$,http://makeup-api.herokuapp.com/api/v1/products/1016.json,https://www.purpicks.com/product/lotus-cosmetics-usa/,eyeshadow,,"[Organic, USDA Organic, purpicks]",2018-09-02 22:52:06.804,https://purpicks.com/,182.8578683021324
Grape (Demi-Matte) ,#A6777A,//s3.amazonaws.com/donovanbailey/products/api_featured_images/000/000/275/original/data?1514063291,pure anada,,2016-10-01 18:30:03.877,,"Pure Anada is pleased to bring you a lovely selection of convenient pressed mineral colors!   You’ll love the silky texture and longevity of these very wearable shades.Mineral pigments and organic Jojoba are pressed together to create a natural makeup product. You can have confidence that you are making a beautiful, healthy choice!Pure Anada pressed colors are designed to be inserted into customizable magnetic compacts like the Pure Ananda Reusable Magnetic Compact. Design your own palette! What look do you go for: the natural bronzed babe, tropical brights, or classic beauty? Try all three with this get the look with natural makeup piece found on our blog, The Well! Shadow Finishes: Demi-Matte shadows are a combination of opaque matte minerals and luminous satin mica.  This provides both true color and a light-reflecting finish.Matte shadows are soft, silky shadows that do not exude any sheen whatsoever.Shades: Ingredients: Mica (CI 77019), Iron Oxides (CI 77492, CI 77499) Calcium Carbonate, Caprylic Triglyceride *Simmondsia Chinensis (Jojoba seed oil) Ultramarines (CI 77007), Titanium Dioxide (CI 77891) * Certified Organic IngredientVegan, Gluten Free, Non-GMO, Dairy Free, Peanut Free, Natural",275,"https://d3t32hsnjxo7q6.cloudfront.net/i/9b489f80495f5d059d0f49ef38c36664_ra,w158,h184_pa,w158,h184.jpeg",Pure Anada Pressed Mineral Eye Color Pan,8.0,,http://makeup-api.herokuapp.com/api/v1/products/275.json,https://well.ca/products/pure-anada-pressed-mineral-eye-color_83502.html,eyeshadow,4.5,"[Canadian, Non-GMO, Gluten Free, Vegan, Natural]",2017-12-23 21:08:11.558,https://well.ca,182.87700784953805
color 6,#806A60,//s3.amazonaws.com/donovanbailey/products/api_featured_images/000/000/284/original/data?1514063294,e.l.f.,palette,2016-10-01 18:30:17.900,,"These ultra-silky and lustrous eyeshadows look like a powder but feel like a cream, allowing for a smooth and flawless application. Use to contour, line, and highlight for a radiant finish. The luminous, shimmery formula creates a gorgeous range of looks for both day and night. ",284,"https://d3t32hsnjxo7q6.cloudfront.net/i/7282990c0ae826129a437ff3cb823cab_ra,w158,h184_pa,w158,h184.jpg",e.l.f. Studio Prism Eyeshadow,13.99,,http://makeup-api.herokuapp.com/api/v1/products/284.json,https://well.ca/products/elf-studio-prism-eyeshadow_105278.html,eyeshadow,4.8,[Vegan],2017-12-26 00:38:39.219,https://well.ca,183.12017911743098
color 3,#918081,//s3.amazonaws.com/donovanbailey/products/api_featured_images/000/000/299/original/data?1514063297,covergirl,,2016-10-01 18:30:45.878,,"This collection of great shades is handpicked by CoverGirl's makeup pros and 
designed to make your eye look go from day to night. They blend 
effortlessly to bring your eyes out beautifully, without overshadowing. 
Experiment using them together or as single shades.Features:Matte, pearl, and sparkle shadesHandpicked by CoverGirl's makeup pros to make your eye look go from day to nightBlends easily without overshadowingTips for Use:
                            
                            
                               
                            
                            
                               Dust the most neutral shadow in your 3-Kit palette from your lash line to brow line. Blend the second-darkest shade along the crease of your eyes. Run the darkest shade along your upper and lower lash lines. Finish the look with two coats of mascara. 
                            
                        
                            
                        ",299,"https://d3t32hsnjxo7q6.cloudfront.net/i/e48da5acde28bd3b1bcc2bff5b9d4a56_ra,w158,h184_pa,w158,h184.jpeg",CoverGirl Eye Enhancers 3-Kit Shadows ,6.49,,http://makeup-api.herokuapp.com/api/v1/products/299.json,https://well.ca/products/covergirl-eye-enhancers-3-kit_59872.html,eyeshadow,4.0,[],2017-12-23 21:08:17.105,https://well.ca,183.33303030277986
771,#BD9E9B,//s3.amazonaws.com/donovanbailey/products/api_featured_images/000/000/689/original/open-uri20171223-4-b1imkg?1514062730,dior,,2017-12-03 23:22:40.725,GBP,"A weightless texture that blends into the skin and dresses the eye in velvety colour. In a single step, it creates an even and intense matte finish for a professional makeup effect.",689,https://www.dior.com/beauty/version-5.1432748111912/resize-image/ep/0/390/100/0/packshots%252FPDG_Y0148300_F014830821_012016.jpg,Diorshow Fusion Mono,25.5,£,http://makeup-api.herokuapp.com/api/v1/products/689.json,https://www.dior.com/beauty/en_gb/fragrance-beauty/makeup/eyes/eyeshadows/pr-eyeshadows-y0148300-long-wear-professional-mirror-shine-eyeshadow.html,eyeshadow,,[],2017-12-23 20:58:50.521,https://www.dior.com,183.4638929053889
Tough as Taupe ,#81726d,//s3.amazonaws.com/donovanbailey/products/api_featured_images/000/000/279/original/open-uri20171223-4-h37y2c?1514063292,maybelline,,2016-10-01 18:30:10.665,,"Dare to wear 24HR shadow!Maybelline's Color Tattoo Cream Gel Shadow uses ink technology for their most intense, long-lasting colour saturation. The cream formula glides on without creasing and keeps colour vibrant.Ophthalmologist-tested. Safe for sensitive eyes and contact lens wearers.
                    
                    
                    
                        
                        For best results: With 
fingertips, sweep all over eye from inner corner and work outwards. For
 added drama, darken as desired.               ",279,"https://d3t32hsnjxo7q6.cloudfront.net/i/c2ddacc79f4fdd3d23664581c76546bc_ra,w158,h184_pa,w158,h184.png",Maybelline Eye Studio Color Tattoo 24HR Cream Gel Shadow,8.99,,http://makeup-api.herokuapp.com/api/v1/products/279.json,https://well.ca/products/maybelline-eye-studio-color-tattoo_50692.html,eyeshadow,4.5,[],2017-12-23 21:08:13.016,https://well.ca,183.81240436923727
Close to Cocoa (W) ,#865945,//s3.amazonaws.com/donovanbailey/products/api_featured_images/000/000/281/original/data?1514063293,pure anada,,2016-10-01 18:30:13.373,,"Pure Anada Loose Luminous Eye Colours are made with finely milled micas that impart an illuminating glow.  Apply them dry for soft, subtle color, or wet for more vibrant intensity.  Learn how you can use your favourite shade to make customized lip balm with our easy DIY Lip Balm recipe on our blog, The Well!About Shade Tones: Warm Shades (W) if you have yellow undertones in your skinCool Shades (C) if you have blue undertones in your skinNeutral Shades (N) to accent any skin tone or eye colorApplication Tips: Dip your shadow brush into the loose minerals and tap off any excess 
powder.  Gently stipple the minerals on your eye lids.   Make sure your 
skin is well hydrated so the minerals will adhere.  Try misting your 
skin with Pure Anada Marine Mineral Toner, prior to applying your 
makeup.If your shadow is prone to creasing, make sure your lids are free 
from excess oils before applying shadow.  If the problem is persistant, 
try priming your lids with Pure Anada Matte Minerals Finishing Powder or
 a coordinating Velvet Matte Shadow.
Deep shades of loose mineral shadow can be used as eyeliner.  To 
create a soft dry line, dip an angled liner brush into the powder, tap 
it off and line your eyes.  Or to create a liquid liner, wet your brush 
and dip it into the powder.  The minerals will stick to the brush.  Make
 a paste on the back of your hand, or in the lid of the jar.  Apply to 
your eyes!Ingredients: Mica,  Iron Oxides, Ultramarines, May contain: Titanium Dioxide",281,"https://d3t32hsnjxo7q6.cloudfront.net/i/4daf84bee451c265ec04f7cc1b8bb7c3_ra,w158,h184_pa,w158,h184.jpeg",Pure Anada Loose Luminous Eye Colour ,8.0,,http://makeup-api.herokuapp.com/api/v1/products/281.json,https://well.ca/products/pure-anada-loose-luminous-eye-colour_93638.html,eyeshadow,4.5,"[Canadian, Natural]",2017-12-23 21:08:13.317,https://well.ca,184.16568627190028
Jenna's Essentials 3,#cfb6a6,//s3.amazonaws.com/donovanbailey/products/api_featured_images/000/000/807/original/data?1514072321,clinique,,2017-12-23 23:35:13.329,USD,Wear shades alone or layered together in different combinations. Crease- and fade-resistant. Ophthalmologist tested for even the most sensitive eyes and contact lens wearers. Mirrored compact with illustrated how-tos plus two sponge-tip applicators.,807,https://www.clinique.com/media/export/cms/products/181x209/clq_7PWL06_181x209.png,All About Shadow&trade; Quad,28.5,$,http://makeup-api.herokuapp.com/api/v1/products/807.json,https://www.clinique.com/product/1598/27033/makeup/eye-shadows/all-about-shadow-quad,eyeshadow,,[],2017-12-23 23:38:41.793,https://www.clinique.com,184.32037326351093
Deep,#7c4e10,//s3.amazonaws.com/donovanbailey/products/api_featured_images/000/000/813/original/data?1514072323,clinique,,2017-12-23 23:35:16.052,USD,Skin-toned colour primer preps lids for improved shadow application and wear. Creates a neutral base that holds All About Shadow eye colour in place for up to 12 hours. Can be worn alone for a natural yet perfected look. Appropriate for sensitive eyes and contact lens wearers. Ophthalmologist tested.,813,https://www.clinique.com/media/export/cms/products/181x209/clq_7W5C_181x209.png,All About Shadow&trade; Primer for Eyes,21.0,$,http://makeup-api.herokuapp.com/api/v1/products/813.json,https://www.clinique.com/product/1598/27035/makeup/eye-shadows/all-about-shadow-primer-for-eyes,eyeshadow,,[],2017-12-23 23:38:43.601,https://www.clinique.com,184.6212338816963
Pink Chocolate 3,#c28c90,//s3.amazonaws.com/donovanbailey/products/api_featured_images/000/000/807/original/data?1514072321,clinique,,2017-12-23 23:35:13.329,USD,Wear shades alone or layered together in different combinations. Crease- and fade-resistant. Ophthalmologist tested for even the most sensitive eyes and contact lens wearers. Mirrored compact with illustrated how-tos plus two sponge-tip applicators.,807,https://www.clinique.com/media/export/cms/products/181x209/clq_7PWL06_181x209.png,All About Shadow&trade; Quad,28.5,$,http://makeup-api.herokuapp.com/api/v1/products/807.json,https://www.clinique.com/product/1598/27033/makeup/eye-shadows/all-about-shadow-quad,eyeshadow,,[],2017-12-23 23:38:41.793,https://www.clinique.com,185.3672031401456
Cashew Later,#cbb1a6,//s3.amazonaws.com/donovanbailey/products/api_featured_images/000/000/812/original/data?1514072323,clinique,,2017-12-23 23:35:15.755,USD,"Creamy, crease-resistant eye colour wears for 8 hours. Instantly cools thanks to a unique applicator. Nourishing ingredients coax fine lid lines into a blanket of smoothness. Antioxidants help protect eye-area skin.",812,https://www.clinique.com/media/export/cms/products/181x209/clq_791P01_181x209.png,Lid Smoothie&trade; Antioxidant 8-Hour Eye Colour,21.0,$,http://makeup-api.herokuapp.com/api/v1/products/812.json,https://www.clinique.com/product/1598/18485/makeup/eye-shadows/lid-smoothie-antioxidant-8-hour-eye-colour,eyeshadow,,[],2017-12-23 23:38:43.316,https://www.clinique.com,185.6906028855526
Reef (Demi-Matte Turquoise) ,#6f9087,//s3.amazonaws.com/donovanbailey/products/api_featured_images/000/000/275/original/data?1514063291,pure anada,,2016-10-01 18:30:03.877,,"Pure Anada is pleased to bring you a lovely selection of convenient pressed mineral colors!   You’ll love the silky texture and longevity of these very wearable shades.Mineral pigments and organic Jojoba are pressed together to create a natural makeup product. You can have confidence that you are making a beautiful, healthy choice!Pure Anada pressed colors are designed to be inserted into customizable magnetic compacts like the Pure Ananda Reusable Magnetic Compact. Design your own palette! What look do you go for: the natural bronzed babe, tropical brights, or classic beauty? Try all three with this get the look with natural makeup piece found on our blog, The Well! Shadow Finishes: Demi-Matte shadows are a combination of opaque matte minerals and luminous satin mica.  This provides both true color and a light-reflecting finish.Matte shadows are soft, silky shadows that do not exude any sheen whatsoever.Shades: Ingredients: Mica (CI 77019), Iron Oxides (CI 77492, CI 77499) Calcium Carbonate, Caprylic Triglyceride *Simmondsia Chinensis (Jojoba seed oil) Ultramarines (CI 77007), Titanium Dioxide (CI 77891) * Certified Organic IngredientVegan, Gluten Free, Non-GMO, Dairy Free, Peanut Free, Natural",275,"https://d3t32hsnjxo7q6.cloudfront.net/i/9b489f80495f5d059d0f49ef38c36664_ra,w158,h184_pa,w158,h184.jpeg",Pure Anada Pressed Mineral Eye Color Pan,8.0,,http://makeup-api.herokuapp.com/api/v1/products/275.json,https://well.ca/products/pure-anada-pressed-mineral-eye-color_83502.html,eyeshadow,4.5,"[Canadian, Non-GMO, Gluten Free, Vegan, Natural]",2017-12-23 21:08:11.558,https://well.ca,185.78213046469244
